{
  "$schema": "https://forge-h2.local/schema/offline-source-register.schema.json",
  "project_id": "FHZ-ENTERPRISE-001",
  "mode": "offline",
  "network_policy": "deny_all_remote_fetch",
  "sources": [
    {"knowledge_id": "KNW-INT-ISO-TC197", "source_kind": "official_standard", "status": "metadata_only", "required_for_baseline": true, "url": "https://www.iso.org/files/live/sites/isoorg/files/store/en/PUB100493.pdf", "local_artifact": null, "revision": "overview at capture", "sha256": null, "notes": "ISO public download returned 403; licensed/current ISO source document must be imported into the offline source pack."},
    {"knowledge_id": "KNW-INT-ISO-22734-2025", "source_kind": "official_standard", "status": "metadata_only", "required_for_baseline": true, "url": "https://www.iso.org/standard/82766.html", "local_artifact": null, "revision": "ISO 22734-1:2025", "sha256": null, "notes": "ISO public page returned 403; official standard text is not included and metadata alone cannot support final design approval."},
    {"knowledge_id": "KNW-INT-IEC-61511", "source_kind": "official_standard", "status": "metadata_only", "required_for_baseline": true, "url": "https://webstore.iec.ch/en/publication/5527", "local_artifact": "knowledge/source-cache/KNW-INT-IEC-61511-official-public.html", "revision": "2026 series public page capture", "sha256": "3d08ccf75efdd6ec6111912fab9631e9a97093ad6af209b5800961164f94b036", "notes": "Official IEC public publication page cached. Licensed/current IEC source document must still be imported for SIS and functional-safety baseline."},
    {"knowledge_id": "KNW-INT-IEC-61882", "source_kind": "official_standard", "status": "metadata_only", "required_for_baseline": true, "url": "https://webstore.iec.ch/en/publication/24321", "local_artifact": "knowledge/source-cache/KNW-INT-IEC-61882-official-public.html", "revision": "2016 public page capture", "sha256": "950ad246f327bfaf273315c6e4ef73e1bf0b2d98452eadc942b85f9e09ae335d", "notes": "Official IEC public publication page cached. HAZOP standard metadata is present; licensed local evidence is still required."},
    {"knowledge_id": "KNW-INT-NFPA-2", "source_kind": "official_standard", "status": "metadata_only", "required_for_baseline": true, "url": "https://link.nfpa.org/all-publications/2/2026", "local_artifact": "knowledge/source-cache/KNW-INT-NFPA-2-official-public.html", "revision": "2026 public page capture", "sha256": "1ed29445e89dca350c0ed56400b2b6d89fec7404c81879ccbeadbd94ac97df9d", "notes": "Official NFPA public publication page cached. Current adopted edition and local fire authority applicability must still be verified."},
    {"knowledge_id": "KNW-INT-FIDIC-SILVER", "source_kind": "contract", "status": "metadata_only", "required_for_baseline": true, "url": "https://fidic.org/books/epcturnkey-contract-2nd-ed-2017-silver-book-reprinted-2022-amendments", "local_artifact": "knowledge/source-cache/KNW-INT-FIDIC-SILVER-official-public.html", "revision": "2017 / 2022 amendments public page capture", "sha256": "b8dad800a9bf83b88b509a64a93d4c4411c72135864d0827dd2d26844b4e1f2a", "notes": "Official FIDIC product page cached. Project contract documents and licensed conditions must be stored locally before contractual baseline use."},
    {"knowledge_id": "KNW-INT-IFC-PS", "source_kind": "official_guidance", "status": "metadata_only", "required_for_baseline": true, "url": "https://www.ifc.org/content/dam/ifc/doc/2023/ifc-performance-standards-2012-en.pdf", "local_artifact": "knowledge/source-cache/KNW-INT-IFC-PS-official-public.pdf", "revision": "2012 public PDF capture", "sha256": "4a5c5305b9134e5abb01d2e6d137d440d5487ed91cf3c0e0c942fab0c470e678", "notes": "Official IFC public PDF cached. Applicability and current lender requirements still require project-specific review."},
    {"knowledge_id": "KNW-INT-EQUATOR-EP4", "source_kind": "official_guidance", "status": "metadata_only", "required_for_baseline": true, "url": "https://equator-principles.com/about-the-equator-principles/", "local_artifact": "knowledge/source-cache/KNW-INT-EQUATOR-EP4-official-public.html", "revision": "EP4 public page capture", "sha256": "23e4ec79a64244b5cec83938c2516c2518c739db19421120ea33a624bafffefc", "notes": "Official Equator Principles public page cached. Applicable lender requirements must still be selected and stored locally."},
    {"knowledge_id": "KNW-KR-KGS-CODE", "source_kind": "official_standard", "status": "metadata_only", "required_for_baseline": true, "url": "https://www.kgs.or.kr/kgs/acde/view.do", "local_artifact": "knowledge/source-cache/KNW-KR-KGS-CODE-official-public.html", "revision": "current public page capture", "sha256": "8812f862fa57bcc612a4b76609a524b8940b1c58b1bab915c214260759d08b63", "notes": "Official KGS public page cached. Current applicable KGS Code text and Korean legal basis must be imported and independently verified locally."},
    {"knowledge_id": "KNW-PROJECT-AGENT-RULES", "source_kind": "project_document", "status": "available_local", "required_for_baseline": true, "url": null, "local_artifact": "docs/04-agent-system/meeting-protocol.md", "revision": "1.0.0", "sha256": null, "notes": "Project operating rule available in workspace."},
    {"knowledge_id": "KNW-PROFESSIONAL-DEFINITION", "source_kind": "project_document", "status": "available_local", "required_for_baseline": true, "url": null, "local_artifact": "knowledge/README.md", "revision": "1.0.0", "sha256": null, "notes": "Professional definition available in workspace."},
    {"knowledge_id": "KNW-FOUNDATION-PROFESSIONAL-CATALOG", "source_kind": "user_provided", "status": "available_local", "required_for_baseline": false, "url": null, "local_artifact": "knowledge/professional-foundations.json", "revision": "1.0.0", "sha256": null, "notes": "User-provided planning catalog; not an official qualification register."},
    {"knowledge_id": "KNW-FOUNDATION-FORMULA-LIBRARY", "source_kind": "user_provided", "status": "available_local", "required_for_baseline": false, "url": null, "local_artifact": "knowledge/formula-library.json", "revision": "1.0.0", "sha256": null, "notes": "User-provided formula library; unit and expert verification required before baseline use."}
  ]
}
